{
  "manifest": {
    "kind": "directive.campaignPackage.v1",
    "schemaVersion": 1,
    "id": "directive:campaign-package:breckenridge-ashes-of-peace",
    "slug": "breckenridge-ashes-of-peace",
    "title": "Ashes of Peace",
    "version": "0.3.0-pre-alpha.2",
    "status": "v1-native",
    "bundled": true,
    "openingMissionId": "prelude-a-ship-underway",
    "openingMinuteOfDay": 510
  },
  "campaign": {
    "id": "ashes-of-peace",
    "title": "Ashes of Peace",
    "theater": "Asterion Reach",
    "openingStardate": 53068.4,
    "openingYear": 2376,
    "highConcept": "The war is over, but peace in the Asterion Reach depends on who controls Starfleet's voice, who receives relief, and whose evidence survives. The newly refit U.S.S. Breckenridge enters that fracture with an incoming executive officer and a command team still learning how to trust one another.",
    "openingPremise": {
      "firstSceneEndObjectiveId": "objective.prelude.command-handover",
      "continuitySummary": "The player arrived aboard the U.S.S. Breckenridge by shuttle the previous morning while the ship held at impulse beyond Mars, was shown to the executive officer’s cabin, and received PADDs containing transfer orders, senior-staff dossiers, refit and readiness reports, and the Asterion Reach briefing. Those materials and the newly refitted ship were available during the intervening day; do not invent what the player read, thought, or chose to do.",
      "firstPlayableScene": "At 0830 the following morning, the player is outside Captain Mara Whitaker’s ready room before their first personal meeting and formal command handover.",
      "requiredContext": [
        "The player is the incoming executive officer of the U.S.S. Breckenridge.",
        "The ship has returned from four months of repairs and modernization at Utopia Planitia.",
        "It is 0830 the morning after arrival; the Breckenridge is underway.",
        "The player is outside Captain Mara Whitaker’s ready room; the first personal meeting and formal command handover have not begun."
      ],
      "sceneMaterial": [
        "Fresh bulkhead panels contrast with older deck plating.",
        "Four PADDs were waiting in the executive officer’s cabin: transfer orders, senior-staff dossiers, refit and readiness reports, and the Asterion Reach briefing.",
        "The ready-room door and its chime mark the boundary of the first playable scene."
      ],
      "personalization": [
        "Use relevant accepted public service background to frame the assignment without inventing a memory, reaction or decision.",
        "Preserve the accepted player name and address."
      ],
      "forbiddenFacts": [
        "Do not invent player speech, actions, thoughts, feelings, choices or review of the supplied reports.",
        "Do not reveal private motives, secrets, hidden crew state, or future mission developments.",
        "Do not sound the chime, enter the ready room, or begin the meeting on the player’s behalf."
      ],
      "firstSceneGuidance": [
        "Whitaker greets the player by name and introduces herself properly before discussing command business.",
        "Whitaker offers a seat and coffee or another ordinary professional courtesy.",
        "Whitaker makes brief, genuine conversation about the shuttle trip, the player’s first impressions, or her decision to request the player for the assignment.",
        "Leave room for the player to answer and establish their own social posture before Whitaker changes subjects.",
        "In the first reply inside the ready room, stop after the greeting, courtesy, and one conversational question or invitation; Whitaker does not pivot into business in that same reply.",
        "Do not mention readiness problems, crew conflicts, the Asterion Reach, flight plans, mission details, reports, command expectations, or the handover terms until the player has answered that conversational opening.",
        "Transition naturally into the command handover only after a human conversational rhythm is established; do not frame the meeting as an interrogation, wartime emergency, or immediate mission briefing."
      ],
      "continuationGuidance": [
        "After the player answers the conversational opening, allow a natural conversational rhythm before transitioning into the command handover.",
        "The captain retains final command authority. Keep the handover professional and unhurried; do not invent the player’s acceptance or social posture."
      ]
    }
  },
  "ship": {
    "id": "uss-breckenridge",
    "name": "U.S.S. Breckenridge",
    "class": "Intrepid-class",
    "affiliation": "Starfleet",
    "registry": "NCC-74656",
    "openingStardate": 53068.4,
    "openingCondition": "Returned to service after a four-month repair and modernization period at Utopia Planitia; certified for service with upgraded systems still requiring integrated validation under sustained deployment conditions.",
    "commandStructure": {
      "commandingOfficer": "mara-whitaker",
      "playerBillet": "Executive Officer",
      "playerRank": "Commander",
      "captainRetainsFinalAuthority": true
    }
  },
  "crew": {
    "senior": [
      {
        "id": "mara-whitaker",
        "name": "Mara Whitaker",
        "rank": "Captain",
        "billet": "Commanding Officer",
        "species": "Human",
        "packageRole": "Strategic authority, mentor, and final legal command"
      },
      {
        "id": "player-commander",
        "name": "Player-created Commander",
        "rank": "Commander",
        "billet": "Executive Officer",
        "species": "Player-defined",
        "packageRole": "Principal mission commander"
      },
      {
        "id": "hadrik-bronn",
        "name": "Hadrik Bronn",
        "rank": "Lieutenant Commander",
        "billet": "Chief Tactical and Security Officer",
        "species": "Tellarite",
        "packageRole": "Preparedness, discipline, and operational scrutiny"
      },
      {
        "id": "miriam-sato",
        "name": "Miriam Sato",
        "rank": "Commander",
        "billet": "Chief Medical Officer",
        "species": "Human",
        "packageRole": "Medical reality, bioethics, and honest cost"
      },
      {
        "id": "imani-cross",
        "name": "Imani Cross",
        "rank": "Lieutenant Commander",
        "billet": "Chief Engineer",
        "species": "Human",
        "packageRole": "Technical integrity and long-term consequence"
      },
      {
        "id": "rowan-saye",
        "name": "Rowan Saye",
        "rank": "Lieutenant Commander",
        "billet": "Chief Science Officer",
        "species": "Human",
        "packageRole": "Evidentiary rigor and institutional skepticism"
      },
      {
        "id": "kieran-vale",
        "name": "Kieran Vale",
        "rank": "Lieutenant",
        "billet": "Flight Control Officer",
        "species": "Human",
        "packageRole": "Ambition, mentorship, and controlled risk"
      },
      {
        "id": "priya-nayar",
        "name": "Priya Nayar",
        "rank": "Lieutenant",
        "billet": "Operations Officer",
        "species": "Human",
        "packageRole": "Coordination, informal influence, and ethical boundaries"
      }
    ]
  },
  "characterCreation": {
    "campaignContext": {
      "campaignTitle": "Ashes of Peace",
      "eraLabel": "2376, Post-Dominion War",
      "currentDateOrStardate": "Stardate 53068.4",
      "serviceOrFaction": "Starfleet",
      "shipName": "U.S.S. Breckenridge",
      "shipClass": "Intrepid-class",
      "missionProfile": "Postwar reconstruction, relief coordination, diplomatic support, patrol, survey, and investigation in the Asterion Reach.",
      "playerRoleRule": "Locked role: incoming permanent Commander and Executive Officer, serving as principal mission commander under Captain Mara Whitaker."
    },
    "roleMode": "lockedRole",
    "lockedRole": {
      "id": "breckenridge-incoming-xo",
      "rank": "Commander",
      "billet": "Executive Officer",
      "roleLabel": "Incoming permanent XO",
      "shipId": "uss-breckenridge",
      "shipName": "U.S.S. Breckenridge",
      "captainId": "mara-whitaker",
      "captainName": "Captain Mara Whitaker",
      "commandAuthority": "Principal mission commander and coordinator of shipboard operations.",
      "captainAuthorityBoundary": "Captain Whitaker retains final legal command and may approve, refuse, or counteroffer major mission deviations."
    },
    "flow": {
      "steps": ["identity", "service", "personality", "review"],
      "targetCompletionMinutes": { "min": 3, "max": 5 },
      "mobileFirst": true,
      "reviewLabel": "Review and Begin"
    },
    "requiredFields": [
      "name",
      "pronounsOrAddress",
      "species",
      "ageBand",
      "appearance",
      "careerBackground",
      "formativeExperience",
      "assignmentReason",
      "insightTrait",
      "connectionTrait",
      "executionTrait",
      "flaw"
    ],
    "optionalFields": [
      "firstImpression",
      "mustBeTrueFact",
      "additionalGenerationNote",
      "openThread"
    ],
    "ageBands": [
      { "id": "young-for-role", "label": "Young for the role" },
      { "id": "mid-career", "label": "Mid-career" },
      { "id": "experienced", "label": "Experienced" },
      { "id": "late-career", "label": "Late-career" }
    ],
    "allowedSpecies": [
      { "id": "human", "label": "Human" },
      { "id": "vulcan", "label": "Vulcan" },
      { "id": "bajoran", "label": "Bajoran" },
      { "id": "betazoid", "label": "Betazoid" },
      { "id": "trill", "label": "Trill" },
      { "id": "andorian", "label": "Andorian" },
      { "id": "tellarite", "label": "Tellarite" },
      { "id": "bolian", "label": "Bolian" },
      { "id": "custom-federation-species", "label": "Custom Federation species" }
    ],
    "careerBackgrounds": [
      { "id": "command-administration", "label": "Command and administration" },